{
  "format": "video-prompt-generator",
  "schemaVersion": "1.0.0",
  "provider": "omni",
  "modelSelection": "omni-flash-1.1",
  "generationMode": "ambient",
  "motionPlan": {
    "schemaVersion": "1.0.0",
    "provider": "omni",
    "model": "omni-flash-1.1",
    "mode": "ambient",
    "durationSeconds": null,
    "source": {
      "subjectType": "custom",
      "subjectEn": "Mochi, the small hedgehog wearing cream headphones",
      "subjectZh": "Mochi，戴米白色耳機的小刺蝟",
      "sceneNotesEn": "",
      "sceneNotesZh": "",
      "elementsConfirmed": false,
      "image": {
        "name": "mochi-reference.png",
        "mime": "image/png",
        "bytes": 600000,
        "width": 1920,
        "height": 1080
      },
      "region": null
    },
    "subjectMotions": [
      "breathing"
    ],
    "environmentalMotions": [
      "steam",
      "rain"
    ],
    "primaryMotion": "steam",
    "intensity": "subtle",
    "motionTiming": "natural",
    "camera": "locked",
    "loop": "match-pose",
    "preservation": [
      "identity",
      "face",
      "proportions",
      "objects",
      "composition",
      "lighting",
      "palette",
      "background",
      "style"
    ],
    "rotation": {
      "type": "turntable",
      "angle": 360,
      "direction": "clockwise",
      "speed": "uniform",
      "axis": "y",
      "centered": true,
      "stableFraming": true,
      "consistentScale": true,
      "stableLighting": true,
      "geometry": true,
      "details": true,
      "returnToStart": true,
      "inputMode": "single"
    },
    "audio": "none-requested",
    "length": "balanced",
    "presetId": "cafe-rain-window"
  },
  "sourceImageReference": {
    "name": "mochi-reference.png",
    "mime": "image/png",
    "bytes": 600000,
    "width": 1920,
    "height": 1080
  },
  "generatedEnglishPrompt": "Animate the supplied image as a natural continuation of the existing scene, following the motion intent below.\n\nKeep the camera locked on a static tripod throughout the shot.\n\nSecondary motion: If a breathing character or animal is already visible in the source image, Mochi, the small hedgehog wearing cream headphones should breathe gently with small chest movement.\n\nPrimary motion: If a steaming drink is already visible in the source image, thin steam drifts upward softly. Secondary motion: If a rain-covered window is already visible in the source image, raindrops slide slowly down the existing window.\n\nKeep movement subtle and restrained. Let selected movements recur at relaxed, natural intervals.\n\nPreserve identity and appearance, facial features, original proportions, existing objects, composition, lighting setup, color palette, background structure, visual style from the source image, where those features are visible.\n\nLet the selected movements settle back to the starting pose and framing at the end of the clip.\n\nFocus on visual motion; no audio is requested.",
  "compilerVersion": "1.0.0",
  "capabilitySnapshotDate": "2026-10-11",
  "presetIdentity": "cafe-rain-window",
  "loopSettings": {
    "strategy": "match-pose",
    "returnToStart": false
  },
  "qcWarnings": [
    {
      "id": "unconfirmed-elements",
      "severity": "recommendation",
      "messageZh": "未確認已選元素在原圖存在；提示只會要求「如原圖已有」的動作。",
      "messageEn": "Selected image elements are unconfirmed; motion instructions are conditional."
    },
    {
      "id": "loop-guarantee",
      "severity": "recommendation",
      "messageZh": "Loop-friendly 是創作意圖，不能保證數學上無縫；生成後應檢查動作及接點。",
      "messageEn": "Loop-friendly is an intention, not a seamless-loop guarantee."
    },
    {
      "id": "audio-removal",
      "severity": "recommendation",
      "messageZh": "未要求音訊不等於保證靜音；配 Jazz 音樂時可在最後渲染移除生成音軌。",
      "messageEn": "No requested audio is not a silence guarantee; remove generated audio during rendering."
    }
  ],
  "exportTimestamp": "2026-10-11T09:00:00.000Z"
}
