{
  "format": "video-prompt-generator",
  "schemaVersion": "1.0.0",
  "provider": "omni",
  "modelSelection": "omni-flash-1.1",
  "generationMode": "ambient",
  "motionPlan": {
    "schemaVersion": "1.0.0",
    "provider": "omni",
    "model": "omni-flash-1.1",
    "mode": "ambient",
    "durationSeconds": null,
    "source": {
      "subjectType": "unspecified",
      "subjectEn": "",
      "subjectZh": "",
      "sceneNotesEn": "",
      "sceneNotesZh": "",
      "elementsConfirmed": false,
      "image": null,
      "region": null
    },
    "subjectMotions": [
      "breathing"
    ],
    "environmentalMotions": [
      "steam",
      "rain"
    ],
    "primaryMotion": "steam",
    "intensity": "subtle",
    "motionTiming": "natural",
    "camera": "locked",
    "loop": "match-pose",
    "preservation": [
      "identity",
      "face",
      "proportions",
      "objects",
      "composition",
      "lighting",
      "palette",
      "background",
      "style"
    ],
    "rotation": {
      "type": "turntable",
      "angle": 360,
      "direction": "clockwise",
      "speed": "uniform",
      "axis": "y",
      "centered": true,
      "stableFraming": true,
      "consistentScale": true,
      "stableLighting": true,
      "geometry": true,
      "details": true,
      "returnToStart": true,
      "inputMode": "single"
    },
    "audio": "none-requested",
    "length": "balanced",
    "presetId": null
  },
  "sourceImageReference": null,
  "generatedEnglishPrompt": "Continue the supplied image naturally, focusing on the requested movement.\n\nPrimary motion: If a steaming drink is already visible in the source image, thin steam drifts upward softly. Alongside it, If a rain-covered window is already visible in the source image, raindrops slide slowly down the existing window.\n\nAlongside it, If a breathing character or animal is already visible in the source image, let the existing subject breathe gently with small chest movement.\n\nKeep movement subtle and restrained. Let selected movements recur at relaxed, natural intervals.\n\nKeep the camera locked on a static tripod throughout the shot.\n\nPreserve identity and appearance, facial features, original proportions, existing objects, composition, lighting setup, color palette, background structure, visual style from the source image, where those features are visible.\n\nLet the selected movements settle back to the starting pose and framing at the end of the clip.\n\nFocus on visual motion; no audio is requested.",
  "compilerVersion": "1.1.0",
  "capabilitySnapshotDate": "2026-10-11",
  "presetIdentity": null,
  "loopSettings": {
    "strategy": "match-pose",
    "returnToStart": false
  },
  "qcWarnings": [
    {
      "id": "no-source",
      "severity": "recommendation",
      "messageZh": "未載入本機原圖；動作只按你的選擇及確認狀態編譯，請在供應商網站自行提供原圖。",
      "messageEn": "No local source image is loaded; motion follows your explicit selections and confirmation. Supply the actual image to the provider."
    },
    {
      "id": "unconfirmed-elements",
      "severity": "recommendation",
      "messageZh": "未確認已選元素在原圖存在；提示只會要求「如原圖已有」的動作。",
      "messageEn": "Selected image elements are unconfirmed; motion instructions are conditional."
    },
    {
      "id": "loop-guarantee",
      "severity": "recommendation",
      "messageZh": "Loop-friendly 是創作意圖，不能保證數學上無縫；生成後應檢查動作及接點。",
      "messageEn": "Loop-friendly is an intention, not a seamless-loop guarantee."
    },
    {
      "id": "audio-removal",
      "severity": "recommendation",
      "messageZh": "未要求音訊不等於保證靜音；配 Jazz 音樂時可在最後渲染移除生成音軌。",
      "messageEn": "No requested audio is not a silence guarantee; remove generated audio during rendering."
    }
  ],
  "exportTimestamp": "2026-10-11T12:00:00.000Z"
}
